cluster,words,prominence
2,cr hpi dney lacs bern item_link akoledov birb martell wrapper rus ancestor photographs lawaya scammers thumbnail altuser dber dotster kindly captcha lotto airt_reg alsdexception semihidden parrish photographer orion photos partisan carter pinterest flickr photography unhidewhenused jf gmail pulitzer cw entries prize photo kevin girl sl photograph kidney whats vulture scherff,372.6847562835827
5,links reserved copyright posts forums content subscribe user users airt_reg information website cr search semihidden hpi akoledov blog martell cookies site comments follow related newsletter unhidewhenused sections alsdexception lawaya page pages apr altuser popular notifications blogs articles rus kindly privacy captcha rights dney lotto updates entries birb sl topics dotster,254.83693790854542
10,carter photograph kevin photojournalist photographer vulture photographs photo capture photography girl photographers capturing taking picture sontag ethical feel sudan reality images bokeh chased famine photojournalism lacs starving suffering item_link situations dney helping lens sudanese cr image child because bern frame viewer scene audience ethics situation camera crawling photos suicide but,219.0631243503076
11,birb really something fucking just feel shit cr dney fuck me maybe ll like lol thing memes don yeah going ve know ancestor love wrapper mom fluff weird tumblr cute bern wow fun eat item_link alsdexception pics lacs comment anything guy nice whats myself meme slot hell pretty ok scammers,182.9892343396978
7,malnutrition poverty slideshare hunger countries food agriculture presentations voce cervical hpi income famine education developing diet poor poorest cr agricultural drought cookies starvation sustainable slide causes population dney economic sudan disease insecurity parrish diseases growth factors browsing captcha increase lack buttons million inequality improve extreme akoledov water health risk consumption,170.0016159202901
4,napalm vietnamese vietnam captured phuc ut photograph iconic saigon photographer image girl picture kim kurdi photo taken ap cong nagasaki war nick fleeing aylan symbol old boy burning soldier hiroshima quang shows burned viet monk falling square village nguyen standing prize drew pulitzer eddie depicts tank lange rescued famous execution,167.29391379440315
0,god jesus christ yhvh bible scriptures faith eternal heaven sin righteous scripture believers pray holy elohim endif sins christians verse salvation spirit spiritual blessed glory lord wisdom dney things christianity wrapper matthew evil vedic prophet teach spiritually teachings religions prayer revelation hinduism ourselves allah loving shall grace cr angels word,113.8405998811923
12,cr dney vultures depressed whatsapp bern app lacs replied celebration kevin akoledov happened scammers gmail gospel kindly got waiting orion kidney depression gain alsdexception pastor suicide airt_reg martell semihidden sudanese unhidewhenused hpi rus parrish achievement altuser catch jf sl girl cw adrian lawaya dber lived carter download wrapper dotster captcha,106.97667930206929
6,oosterbroek carter silva ken marinovich joao kevin suicide bang johannesburg haunted vivid corpses apartheid starving greg chased vulture ayod girl depressed sudan photojournalist memories trigger killings child landed pulitzer lucky feeding won wounded debts committed killer photographer prize scene photograph fate sudanese toddler shot club famine anger took photo jf,94.71374246733359
3,scan administrator infected network captcha sure device temporary prevent run virus devices shared connection future proves make access property please office looking web personal if ask across can enable gives you javascript anti semihidden unhidewhenused complete like browser cookies at home alsdexception are your page or why step cw site,71.86612063462051
8,post media thread jf threads member expert page users topic forum go ya archives register latest posting userinfo postbit banned forums css popupmenu content formerly styles search link user thumbnail must posts areas rules members site replies es registered lonrho generated cr useful politics bern following sites nice resolutions active,68.78855365987441
13,embed uploaded document description options sharing content copyright add discover useful offer available documents information legal related share interests flickr find including date learn website support view social books browser check any button tools cards everything thank menu link developers exclusive click products users following code use more major viewing,57.52281234412687
9,migrant workers stranded gujarat lockdown delhi home migrants coronavirus exodus covid authorities villages lakh outbreak pandemic chief transport thousands virus cities india migration foot jobs earn minister rural sparked country walk announced relief return reports infected said huge government parrish thursday khan kumar cr ministry hungry numbers hpi district whatsapp,54.416897219934484
14,commenting connecting account using google icon twitter log wordpress fill recent facebook navigation notifications leave archives click reply categories meta your details posts comments below address enter blog receive follow hits followers stats you spam flickr are email pages join reduce javascript search item_link dney subscribe cr lacs blogs this,50.95143055055626
1,meme memes websites password forgot offensive sign problems collection otherwise enter third entries save success cr kindly hello dney email removed content lacs info loading log whats instructions kid your blog connect martell twitter comments attacks funny bern just rd adrian facebook topic scammers data consent notifications browser ll thank,45.053581343465254
